no.,word, sentence
1,Ecosystem, "In the grand ecosystem of life, every creature plays a vital role."
2,Biodiversity, "The tapestry of life is woven with the threads of biodiversity."
3,Conservation, "In the face of rapid change, conservation becomes our lifeline to the past."
4,Habitat, "Every heart seeks a habitat where it can thrive."
5,Species, "Just as every species has its niche, every person has their place in the world."
6,Population, "The population of ideas in the human mind is as diverse as the stars in the sky."
7,Climate, "The climate of kindness fosters growth and prosperity."
8,Weather, "The weather of life is full of sunshine and storms, each shaping us in their own way."
9,Atmosphere, "An atmosphere of positivity can uplift the spirit."
10,Ozone, "Just as the ozone protects the Earth, love protects the heart."
11,Greenhouse, "A greenhouse of encouragement allows potential to bloom."
12,Carbon, "Carbon, the building block of life, reminds us of our interconnectedness."
13,Nitrogen, "Nitrogen in the soil nurtures the plants, just as patience nurtures the soul."
14,Oxygen, "Oxygen to the body is like love to the heart, essential and life-giving."
15,Hydrogen, "Hydrogen fuels the stars, and passion fuels the spirit."
16,Photosynthesis, "Photosynthesis transforms light into life, just as education transforms information into knowledge."
17,Respiration, "Respiration is to the body what meditation is to the mind."
18,Decomposition, "Decomposition in nature mirrors the process of letting go in life."
19,Nutrient, "A nutrient for the soul, kindness nourishes the spirit."
20,Cycle, "The cycle of life spins, weaving the tapestry of existence."
21,Food chain, "In the food chain of knowledge, curiosity is the primary consumer."
22,Predator, "Fear is the predator that stalks the mind."
23,Prey, "Innocence is often the prey of deception."
24,Herbivore, "A herbivore in the wild finds sustenance in the simplest of things, much like a contented mind."
25,Carnivore, "Ambition, like a carnivore, consumes all in its path."
26,Omnivore, "An omnivore in nature, the human mind feeds on both joy and sorrow for growth."
27,Parasite, "Negativity is a parasite that drains positivity."
28,Symbiosis, "Symbiosis in nature is a reflection of harmony in diversity."
29,Mutualism, "Mutualism in relationships fosters growth and prosperity."
30,Commensalism, "In the commensalism of life, one's joy may bloom without harming another."
31,Competition, "Competition, when healthy, can lead to growth and innovation."
32,Cooperation, "Cooperation is the melody that orchestrates a symphony of success."
33,Adaptation, "Adaptation is the melody of survival in the symphony of life."
34,Evolution, "Evolution is the story of life's resilience over time."
35,Natural selection, "Natural selection in nature is akin to the survival of the fittest ideas in the mind."
36,Mutation, "A mutation in perspective can lead to a revolution in understanding."
37,Speciation, "Speciation in thoughts leads to the diversity of ideas."
38,Extinction, "Extinction of hatred is the dawn of peace."
39,Fossil, "A fossil of the past, each memory holds a story etched in time."
40,Geology, "Geology, the study of the earth, is akin to introspection, the study of the self."
41,Plate tectonics, "Plate tectonics shape the earth, just as experiences shape our lives."
42,Volcano, "A volcano of emotions can both create and destroy."
43,Earthquake, "An earthquake of change can shift the landscape of life."
44,Mountain, "Every mountain of challenge holds a breathtaking view of achievement."
45,Valley, "In the valley of despair, seeds of hope are sown."
46,River, "A river of dreams nourishes the landscape of ambition."
47,Ocean, "An ocean of knowledge awaits the thirsty learner."
48,Lake, "A lake of tranquility amidst the chaos reflects the peace within."
49,Pond, "A pond of wisdom collects the raindrops of experience."
50,Wetland, "A wetland of opportunities nurtures the growth of potential."